{
  "$schema": "https://json-schema.org/draft/2020-12/schema",
  "$id": "https://graft.dev/schemas/surface/1.json",
  "title": "Graft surface",
  "description": "The extension contract a host adapter publishes for one host version: slots, capabilities, permission scopes and migrations from the previous surface. Identified by its content hash.",
  "type": "object",
  "required": ["graft", "host", "hostVersion", "slots", "capabilities", "scopes"],
  "additionalProperties": false,
  "properties": {
    "graft": { "const": 1 },
    "host": { "type": "string", "pattern": "^[a-z][a-z0-9-]*$" },
    "hostVersion": { "type": "string", "minLength": 1 },
    "hash": {
      "description": "Content hash of the contract (everything except hash, hostVersion, previous and migrations, canonical JSON, SHA-256). Verified when present.",
      "type": "string",
      "pattern": "^sha256:[0-9a-f]{64}$"
    },
    "fingerprint": {
      "description": "Host-computed fingerprint of the host half (structure only, no text, version or roles). The plugin uses it at runtime to find the snapshot it matches.",
      "type": "string",
      "pattern": "^sha256:[0-9a-f]{64}$"
    },
    "previous": {
      "description": "Content hash of the surface the migrations start from.",
      "type": "string"
    },
    "slots": {
      "type": "object",
      "propertyNames": { "$ref": "#/$defs/symbol" },
      "additionalProperties": { "$ref": "#/$defs/slot" }
    },
    "capabilities": {
      "type": "object",
      "propertyNames": { "$ref": "#/$defs/symbol" },
      "additionalProperties": { "$ref": "#/$defs/capability" }
    },
    "scopes": {
      "type": "object",
      "propertyNames": { "pattern": "^[a-z][a-z0-9_.]*:(read|write)$" },
      "additionalProperties": { "$ref": "#/$defs/scope" }
    },
    "audiences": {
      "description": "Audience values a spec may use (for WordPress: role slugs).",
      "type": "array",
      "items": { "type": "string" },
      "uniqueItems": true
    },
    "model": {
      "description": "The host's content model the surface was generated from, in a host-defined shape (for WordPress: the exposed post types with their fields and taxonomies). Verification sandboxes use it to reproduce the site. Part of the contract, so it is hashed.",
      "type": "object"
    },
    "triggers": {
      "description": "What builds may do without a viewer (ADR 0010): the host events and capabilities triggers may use, and the bounds every trigger runs within. Absent when the host runs no triggers.",
      "$ref": "#/$defs/triggers"
    },
    "migrations": {
      "type": "array",
      "items": { "$ref": "#/$defs/migration" }
    }
  },
  "$defs": {
    "symbol": {
      "type": "string",
      "pattern": "^[a-z][a-z0-9-]*([./][a-z][a-z0-9-_]*)*$"
    },
    "jsonSchema": {
      "description": "An embedded JSON Schema (draft 2020-12). Adapters normalize host schemas (e.g. draft-04 ability schemas) into this.",
      "type": ["object", "boolean"]
    },
    "slot": {
      "type": "object",
      "required": ["kind", "title"],
      "additionalProperties": false,
      "properties": {
        "kind": {
          "description": "owned: the customization gets its own space. extension: it attaches to an existing host screen.",
          "enum": ["owned", "extension"]
        },
        "title": { "type": "string" },
        "description": { "type": "string" },
        "screen": { "description": "Host screen an extension slot lives on.", "type": "string" },
        "anchor": { "description": "Host hook or component the slot attaches to. What re-anchoring replaces.", "type": "string" },
        "options": { "$ref": "#/$defs/jsonSchema" },
        "provides": {
          "description": "Props the slot passes to the UI, e.g. the current post id.",
          "$ref": "#/$defs/jsonSchema"
        },
        "successor": { "description": "Slot that replaces this one if it is deprecated.", "$ref": "#/$defs/symbol" },
        "deprecated": { "type": "boolean" }
      }
    },
    "capability": {
      "type": "object",
      "required": ["kind", "input", "output", "scopes"],
      "additionalProperties": false,
      "properties": {
        "kind": { "enum": ["read", "write"] },
        "description": { "type": "string" },
        "input": { "$ref": "#/$defs/jsonSchema" },
        "output": { "$ref": "#/$defs/jsonSchema" },
        "scopes": {
          "description": "Permission scopes a grant must include to call this capability.",
          "type": "array",
          "items": { "type": "string", "pattern": "^[a-z][a-z0-9_.]*:(read|write)$" },
          "minItems": 1
        },
        "binding": {
          "description": "Host-specific binding, e.g. { ability: 'graft/posts-list' }. Opaque to the core.",
          "type": "object"
        }
      }
    },
    "scope": {
      "type": "object",
      "required": ["title"],
      "additionalProperties": false,
      "properties": {
        "title": { "description": "Plain-language description an admin approves.", "type": "string" },
        "host": {
          "description": "Host permissions the scope maps to (for WordPress: capabilities). Opaque to the core.",
          "type": "array",
          "items": { "type": "string" }
        }
      }
    },
    "triggers": {
      "type": "object",
      "required": ["minInterval", "maxPerRun", "capabilities", "events"],
      "additionalProperties": false,
      "properties": {
        "identity": { "description": "Plain-language name of the identity triggers run as, shown to the admin who approves them.", "type": "string" },
        "minInterval": { "description": "Shortest schedule, in seconds.", "type": "integer", "minimum": 60 },
        "maxPerRun": { "description": "Most capability calls one run may make; also the default per-run cap.", "type": "integer", "minimum": 1 },
        "maxEventRunsPerHour": { "description": "Most runs one event trigger may start in an hour; later events are dropped and logged.", "type": "integer", "minimum": 1 },
        "capabilities": {
          "description": "Capabilities a trigger may call, to select targets or act on them. Anything else is refused unattended.",
          "type": "array",
          "items": { "$ref": "#/$defs/symbol" },
          "uniqueItems": true
        },
        "events": {
          "description": "Host events a trigger may run on, each with the subject it passes as the trigger's target.",
          "type": "object",
          "propertyNames": { "$ref": "#/$defs/symbol" },
          "additionalProperties": {
            "type": "object",
            "required": ["title", "provides"],
            "additionalProperties": false,
            "properties": {
              "title": { "type": "string" },
              "description": { "type": "string" },
              "provides": { "description": "Schema of the event's subject: the target.", "$ref": "#/$defs/jsonSchema" }
            }
          }
        }
      }
    },
    "migration": {
      "type": "object",
      "required": ["op"],
      "oneOf": [
        {
          "properties": {
            "op": { "const": "rename" },
            "kind": { "enum": ["slot", "capability", "scope", "event"] },
            "from": { "type": "string" },
            "to": { "type": "string" }
          },
          "required": ["op", "kind", "from", "to"]
        },
        {
          "properties": {
            "op": { "const": "remove" },
            "kind": { "enum": ["slot", "capability", "scope", "event"] },
            "symbol": { "type": "string" }
          },
          "required": ["op", "kind", "symbol"]
        }
      ]
    }
  }
}
